{
  "artifact_class": "a0x-material-execution-contract",
  "ccp": {
    "command_roles": [
      "admission_status",
      "resource_status",
      "plan",
      "doctor",
      "dry_run",
      "repository_run",
      "guard_exec"
    ],
    "hash_before_command": true,
    "location_roles": {
      "managed_cache_root": "managed_cache_root",
      "repository_root": "repository_root"
    },
    "matrix_config_binding": {
      "locator": ".commit-ci-preflight.toml",
      "raw_sha256": "78d0ce348a864ea99a1a7018bc00403bdd2349b5f7f6e39d6a61ec10714a20fd"
    },
    "matrix_plan_binding": {
      "outer_digest": "sha256:8eb0172c30aac8f9b47f65cebd222ee6615b17e4053a5a16e2be5583f3a10331",
      "plan_output_sha256": "0969a1eeb62b2a92593cda0b75c8814d7eca893bebc736ec968f02aa9f2a5fad",
      "python311_digest": "sha256:aa69a8795e20733a516fac99b253cfc26a9f963825ff1fa9ca5638364f7fc943",
      "python312_digest": "sha256:072e50972a02f2df710bf81620ca058d230f0637bcc16a47ba35562fe1358510"
    },
    "matrix_plan_profile": "matrix-v2-legacy-v1",
    "matrix_policy_binding": {
      "locator": ".commit-ci-policy-v2.toml",
      "raw_sha256": "258361889b30ee6c18f3c2cd901672d43827c786cc05c599eb7f9cb09cb65048"
    },
    "producer_role": "ccp_executable",
    "qualification_status": "terminal_heavy_qualified",
    "sha256": "c8021e2322e172686c0a0c07d2b0260eafb5812d085d2306dbbde3fe4e964bd4",
    "source_commit": "27adf8d0820b3cd96f9c5e149de9b580ae41f639",
    "source_tree": "d8e0364d1313fde0898a44517ae6d233d9e10763",
    "version": "commit-ci-preflight 0.1.0"
  },
  "gate_a": {
    "provider": "github-hosted-attestation-v1",
    "workflow_path": ".github/workflows/a0x-hosted-gate-a.yml",
    "event": "push",
    "ref": "refs/heads/main",
    "required_lanes": ["a0x-no-model", "a0x-synthetic", "documentation-audit", "repository-python311", "repository-python312", "schema-cross-validation-python311", "schema-cross-validation-python312"],
    "size_ceilings_bytes": {"manifest": 32768, "attestation_bundle": 1048576, "trusted_root": 2097152, "transport": 16384},
    "verifier": {"role": "github_cli_verifier", "version": "gh version 2.97.0 (2026-07-31)", "sha256": "6a2ab5fa89553eac1f0df50a26a5eaeea9a665d8971f5a51b32487b72c708f5c", "policy_raw_sha256": "e2e11f6bec9740d7e2025eae80fe87fa29d79436faa3a2c5c1ca7d55ceb9e4b4"},
    "predicate_type": "https://slsa.dev/provenance/v1",
    "cert_oidc_issuer": "https://token.actions.githubusercontent.com",
    "deny_self_hosted_runners": true,
    "require_verified_timestamp": true,
    "workflow_raw_sha256": "76800cbdcf5db80b4f025c254de8936b4ceef8842702807ae426f03c0363d079",
    "requirements_schema_lock_raw_sha256": "0bbafebbe4fdb6028f5e8565eae397d18d6ace90e7e5e2c5b9472aa924162be7",
    "action_manifest_raw_sha256": "f84777250a50082cd4f2390d949193c73d983475d32c08b02536fdf5ebd8a7fd",
    "lane_manifest_raw_sha256": "4a6754e77e4a440d9e1af03d16017272e194bc6953cec16dd9473aa0b5929a97"
  },
  "contract_version": "a0x-material-execution-contract-v3",
  "ccp_binding_role": "historical_matrix_only",
  "vertical_guard": {
    "producer_role": "ccp_executable",
    "source_commit": "1015a0b42962dbf18334fd6dfc0d9148551d4984",
    "source_tree": "2ebad04d6dc718c7aaa2534d304cde7797460a97",
    "sha256": "45127a90f1adace54547ccb997d2a1914fe421e8062b51a9ddd09fd9d5538bc2",
    "version": "commit-ci-preflight 0.1.0",
    "resource_policy": "macos-v5",
    "qualification_basis": "operator-recorded-isolated-guard",
    "uses_repository_configuration": false,
    "emits_receipt": false,
    "hash_before_command": true,
    "max_guard_exec_count": 1
  },
  "max_run_count": 1,
  "offline": {
    "generation": false,
    "local_cpu_float32": true,
    "network": false
  },
  "repository": "MarcoPorcellato/Latent-TRIZ",
  "stop_boundaries": [
    "before_model_load",
    "after_first_terminal_outcome",
    "after_one_sealed_target_read"
  ]
}
